{
  "_policyVersion": 1,
  "_locked": {
    "aiChatGuard.enabled": true,
    "submitGuard.enabled": true,
    "uploadGuard": true
  },
  "detectionMode": "auto",
  "aiChatGuard": {
    "enabled": true,
    "autoRedactOnAiSites": true,
    "blockSubmitUntilRedacted": true,
    "interceptUploads": true,
    "showAiBanner": true,
    "customAiDomains": []
  },
  "submitGuard": {
    "enabled": true,
    "onlyOnAiSites": true
  },
  "uploadGuard": {
    "enabled": true,
    "onlyOnAiSites": true,
    "confirmBeforeUpload": true,
    "allowBypass": false,
    "blockUnsupported": true,
    "maxFileSizeBytes": 26214400
  }
}
